{
  "schema": "n.human_ai_mathematics.paper_1_3_full_lean_status.v1",
  "effective_date_utc": "2026-07-29",
  "owner_rule": "Full-manuscript Lean FULL_PASS is required before a manuscript may be called fully Lean verified; existing public candidate-review packages may remain active with exact bounded formal-verification statements.",
  "global_state": "HINC_ABF_ACTIVE_REVIEW_FSG_MATHEMATICAL_HOLD",
  "papers": {
    "HINC-001": {
      "public_artifact_state": "ACTIVE_PUBLIC_CANDIDATE_TECHNICAL_REVIEW",
      "formal_status": "PARTIAL_PASS",
      "human_candidate_proof": "COMPLETE",
      "bounded_lean_pass": true,
      "full_manuscript_lean_verified": false,
      "known_unformalized_claim_groups": [
        "complete characteristic-two Hochschild derivation",
        "complete presented source algebras",
        "odd normal-form theorem",
        "generator-to-global bracket preservation",
        "natural representability bijections and coordinate bialgebras",
        "complete scheme-theoretic center equality",
        "clopen split as a functorial scheme statement",
        "fppf-derived subgroup and abelianization",
        "idempotent, geometry, tangent, finite-count, and zeta consequences"
      ],
      "external_review": "pending",
      "historical_priority": "unestablished",
      "active_public_review_authorized": true
    },
    "ABF-001": {
      "public_artifact_state": "ACTIVE_PUBLIC_CANDIDATE_TECHNICAL_REVIEW",
      "formal_status": "PARTIAL_PASS",
      "human_candidate_proof": "COMPLETE",
      "bounded_a01_lean_pass": true,
      "full_manuscript_lean_verified": false,
      "completed_formal_lanes": [
        "A01 bidual moment-kernel bridge"
      ],
      "open_formal_lanes": [
        "A02 Reed-Muller duality and degree/coefficient criterion",
        "A03 affine-hyperplane coordinates and complete moment-space construction",
        "A04 order-zero signature and radical classification",
        "A05 order-one alternating matrix pencil and affine-parameter identity",
        "A06 proof-connected finite 16-to-8 atlas and every declared census value"
      ],
      "external_review": "pending",
      "historical_priority": "unestablished",
      "active_public_review_authorized": true
    },
    "FSG-001": {
      "public_artifact_state": "PRIVATE_CANDIDATE_MATHEMATICAL_BLOCKER_HOLD",
      "formal_status": "HOLD_MATHEMATICAL_BLOCKER",
      "human_candidate_proof": "PRIVATE_CANDIDATE_UNDER_CORRECTION",
      "mathematical_blocker": "C06 / main theorem item (v) false as written",
      "private_correction_under_internal_review": true,
      "full_manuscript_lean_verified": false,
      "public_theorem_package_released": false,
      "active_public_review_authorized": false,
      "public_release_authorized": false
    },
    "ACM-001": {
      "public_artifact_state": "HOLD_PENDING_CONSOLIDATION",
      "formal_status": "HOLD_PENDING_CONSOLIDATION",
      "controlling_manuscript_present": false,
      "exact_map_identity_frozen": false,
      "claim_map_complete": false,
      "full_manuscript_lean_verified": false,
      "active_public_review_authorized": false
    }
  },
  "portfolio_gate": {
    "full_pass_required_for_full_lean_claims": true,
    "bounded_partial_pass_allows_active_candidate_review_when_exactly_labeled": true,
    "future_fsg_release_blocked_by_mathematical_counterexample": true,
    "ACM-001_may_advance": false,
    "condition": "ACM-001 remains on hold pending consolidation; FSG-001 remains privately blocked until the mathematical correction and all release gates are accepted."
  },
  "hinc_abf_public_candidate_review_authorized": true,
  "fsg_public_release_authorized": false
}